{"version":"0.1","lang":"ar","source":"estimated","duration":58.32,"scenes":[{"id":"hook","start":0,"end":8.258,"sentences":[{"text":"راتبك موقوف، أكّد بياناتك خلال أربع وعشرين ساعة.","start":0.35,"end":4.188},{"text":"رسالة كهذه تريدك أن تتصرف قبل أن تفكر.","start":4.568,"end":7.658}],"words":[{"w":"راتبك","s":0.35,"e":0.825},{"w":"موقوف،","s":0.825,"e":1.3},{"w":"أكّد","s":1.48,"e":1.813},{"w":"بياناتك","s":1.813,"e":2.43},{"w":"خلال","s":2.43,"e":2.834},{"w":"أربع","s":2.834,"e":3.238},{"w":"وعشرين","s":3.238,"e":3.784},{"w":"ساعة.","s":3.784,"e":4.188},{"w":"رسالة","s":4.568,"e":5.043},{"w":"كهذه","s":5.043,"e":5.447},{"w":"تريدك","s":5.447,"e":5.922},{"w":"أن","s":5.922,"e":6.184},{"w":"تتصرف","s":6.184,"e":6.659},{"w":"قبل","s":6.659,"e":6.992},{"w":"أن","s":6.992,"e":7.254},{"w":"تفكر.","s":7.254,"e":7.658}]},{"id":"signs","start":8.258,"end":23.037,"sentences":[{"text":"ابحث عن علامات التحذير.","start":8.608,"end":10.437},{"text":"ضغط للتصرف بسرعة.","start":10.817,"end":12.171},{"text":"رابط لم تتوقعه.","start":12.551,"end":13.763},{"text":"مرسل لا يمكنك التحقق منه.","start":14.143,"end":16.163},{"text":"وطلب رمزك السري أو رمز تحقق.","start":16.543,"end":18.825},{"text":"لا يطلب أي مكتب رواتب حقيقي هذه الأشياء.","start":19.205,"end":22.437}],"words":[{"w":"ابحث","s":8.608,"e":9.012},{"w":"عن","s":9.012,"e":9.274},{"w":"علامات","s":9.274,"e":9.82},{"w":"التحذير.","s":9.82,"e":10.437},{"w":"ضغط","s":10.817,"e":11.15},{"w":"للتصرف","s":11.15,"e":11.696},{"w":"بسرعة.","s":11.696,"e":12.171},{"w":"رابط","s":12.551,"e":12.955},{"w":"لم","s":12.955,"e":13.217},{"w":"تتوقعه.","s":13.217,"e":13.763},{"w":"مرسل","s":14.143,"e":14.547},{"w":"لا","s":14.547,"e":14.809},{"w":"يمكنك","s":14.809,"e":15.284},{"w":"التحقق","s":15.284,"e":15.83},{"w":"منه.","s":15.83,"e":16.163},{"w":"وطلب","s":16.543,"e":16.947},{"w":"رمزك","s":16.947,"e":17.351},{"w":"السري","s":17.351,"e":17.826},{"w":"أو","s":17.826,"e":18.088},{"w":"رمز","s":18.088,"e":18.421},{"w":"تحقق.","s":18.421,"e":18.825},{"w":"لا","s":19.205,"e":19.467},{"w":"يطلب","s":19.467,"e":19.871},{"w":"أي","s":19.871,"e":20.133},{"w":"مكتب","s":20.133,"e":20.537},{"w":"رواتب","s":20.537,"e":21.012},{"w":"حقيقي","s":21.012,"e":21.487},{"w":"هذه","s":21.487,"e":21.82},{"w":"الأشياء.","s":21.82,"e":22.437}]},{"id":"habit","start":23.037,"end":38.888,"sentences":[{"text":"إليك العادة المفيدة.","start":23.387,"end":24.954},{"text":"لا تضغط على الرابط ولا تردّ.","start":25.334,"end":27.545},{"text":"اتصل بالمكتب على رقم تعرفه مسبقًا.","start":27.925,"end":30.562},{"text":"لا تشارك رمزًا سريًا أو رمزًا لمرة واحدة أبدًا.","start":30.942,"end":34.436},{"text":"ثم أبلغ عن الرسالة، وحذّر زملاءك، واحذفها.","start":34.816,"end":38.288}],"words":[{"w":"إليك","s":23.387,"e":23.791},{"w":"العادة","s":23.791,"e":24.337},{"w":"المفيدة.","s":24.337,"e":24.954},{"w":"لا","s":25.334,"e":25.596},{"w":"تضغط","s":25.596,"e":26},{"w":"على","s":26,"e":26.333},{"w":"الرابط","s":26.333,"e":26.879},{"w":"ولا","s":26.879,"e":27.212},{"w":"تردّ.","s":27.212,"e":27.545},{"w":"اتصل","s":27.925,"e":28.329},{"w":"بالمكتب","s":28.329,"e":28.946},{"w":"على","s":28.946,"e":29.279},{"w":"رقم","s":29.279,"e":29.612},{"w":"تعرفه","s":29.612,"e":30.087},{"w":"مسبقًا.","s":30.087,"e":30.562},{"w":"لا","s":30.942,"e":31.204},{"w":"تشارك","s":31.204,"e":31.679},{"w":"رمزًا","s":31.679,"e":32.083},{"w":"سريًا","s":32.083,"e":32.487},{"w":"أو","s":32.487,"e":32.749},{"w":"رمزًا","s":32.749,"e":33.153},{"w":"لمرة","s":33.153,"e":33.557},{"w":"واحدة","s":33.557,"e":34.032},{"w":"أبدًا.","s":34.032,"e":34.436},{"w":"ثم","s":34.816,"e":35.078},{"w":"أبلغ","s":35.078,"e":35.482},{"w":"عن","s":35.482,"e":35.744},{"w":"الرسالة،","s":35.744,"e":36.361},{"w":"وحذّر","s":36.541,"e":36.945},{"w":"زملاءك،","s":36.945,"e":37.491},{"w":"واحذفها.","s":37.671,"e":38.288}]},{"id":"turn","start":38.888,"end":48.017,"sentences":[{"text":"دورك الآن.","start":39.238,"end":40.046},{"text":"يصلك من رقم زميلك: أرسلت إليك رمزًا بالخطأ، أعِد إرساله لي من فضلك.","start":40.426,"end":45.896},{"text":"احتيال أم آمن؟","start":46.276,"end":47.417}],"words":[{"w":"دورك","s":39.238,"e":39.642},{"w":"الآن.","s":39.642,"e":40.046},{"w":"يصلك","s":40.426,"e":40.83},{"w":"من","s":40.83,"e":41.092},{"w":"رقم","s":41.092,"e":41.425},{"w":"زميلك:","s":41.425,"e":41.9},{"w":"أرسلت","s":42.08,"e":42.555},{"w":"إليك","s":42.555,"e":42.959},{"w":"رمزًا","s":42.959,"e":43.363},{"w":"بالخطأ،","s":43.363,"e":43.909},{"w":"أعِد","s":44.089,"e":44.422},{"w":"إرساله","s":44.422,"e":44.968},{"w":"لي","s":44.968,"e":45.23},{"w":"من","s":45.23,"e":45.492},{"w":"فضلك.","s":45.492,"e":45.896},{"w":"احتيال","s":46.276,"e":46.822},{"w":"أم","s":46.822,"e":47.084},{"w":"آمن؟","s":47.084,"e":47.417}]},{"id":"remember","start":48.017,"end":58.32,"sentences":[{"text":"تذكّر: التصيّد يتظاهر بأنه جهة تثق بها.","start":48.367,"end":51.446},{"text":"اكتشف العلامة، وتوقّف، وتحقّق بطريقة أخرى.","start":51.826,"end":55.178},{"text":"ثم أبلغ عن الرسالة واحذفها.","start":55.558,"end":57.72}],"words":[{"w":"تذكّر:","s":48.367,"e":48.771},{"w":"التصيّد","s":48.951,"e":49.497},{"w":"يتظاهر","s":49.497,"e":50.043},{"w":"بأنه","s":50.043,"e":50.447},{"w":"جهة","s":50.447,"e":50.78},{"w":"تثق","s":50.78,"e":51.113},{"w":"بها.","s":51.113,"e":51.446},{"w":"اكتشف","s":51.826,"e":52.301},{"w":"العلامة،","s":52.301,"e":52.918},{"w":"وتوقّف،","s":53.098,"e":53.573},{"w":"وتحقّق","s":53.753,"e":54.228},{"w":"بطريقة","s":54.228,"e":54.774},{"w":"أخرى.","s":54.774,"e":55.178},{"w":"ثم","s":55.558,"e":55.82},{"w":"أبلغ","s":55.82,"e":56.224},{"w":"عن","s":56.224,"e":56.486},{"w":"الرسالة","s":56.486,"e":57.103},{"w":"واحذفها.","s":57.103,"e":57.72}]}]}
