{"version":"0.1","lang":"en","source":"estimated","duration":40.306,"scenes":[{"id":"hook","start":0,"end":6.43,"sentences":[{"text":"How does an AI model learn?","start":0.35,"end":2.204},{"text":"Not from rules someone wrote, but from examples.","start":2.584,"end":5.83}],"words":[{"w":"How","s":0.35,"e":0.632},{"w":"does","s":0.632,"e":0.968},{"w":"an","s":0.968,"e":1.196},{"w":"AI","s":1.196,"e":1.424},{"w":"model","s":1.424,"e":1.814},{"w":"learn?","s":1.814,"e":2.204},{"w":"Not","s":2.584,"e":2.866},{"w":"from","s":2.866,"e":3.202},{"w":"rules","s":3.202,"e":3.592},{"w":"someone","s":3.592,"e":4.09},{"w":"wrote,","s":4.09,"e":4.48},{"w":"but","s":4.66,"e":4.942},{"w":"from","s":4.942,"e":5.278},{"w":"examples.","s":5.278,"e":5.83}]},{"id":"network","start":6.43,"end":20.35,"sentences":[{"text":"A neural network connects simple units.","start":6.78,"end":9.282},{"text":"A signal passes from the inputs, through the hidden units, to an output.","start":9.662,"end":14.66},{"text":"Each connection has a weight, a number that says how much it matters.","start":15.04,"end":19.75}],"words":[{"w":"A","s":6.78,"e":6.954},{"w":"neural","s":6.954,"e":7.398},{"w":"network","s":7.398,"e":7.896},{"w":"connects","s":7.896,"e":8.448},{"w":"simple","s":8.448,"e":8.892},{"w":"units.","s":8.892,"e":9.282},{"w":"A","s":9.662,"e":9.836},{"w":"signal","s":9.836,"e":10.28},{"w":"passes","s":10.28,"e":10.724},{"w":"from","s":10.724,"e":11.06},{"w":"the","s":11.06,"e":11.342},{"w":"inputs,","s":11.342,"e":11.786},{"w":"through","s":11.966,"e":12.464},{"w":"the","s":12.464,"e":12.746},{"w":"hidden","s":12.746,"e":13.19},{"w":"units,","s":13.19,"e":13.58},{"w":"to","s":13.76,"e":13.988},{"w":"an","s":13.988,"e":14.216},{"w":"output.","s":14.216,"e":14.66},{"w":"Each","s":15.04,"e":15.376},{"w":"connection","s":15.376,"e":16.036},{"w":"has","s":16.036,"e":16.318},{"w":"a","s":16.318,"e":16.492},{"w":"weight,","s":16.492,"e":16.936},{"w":"a","s":17.116,"e":17.29},{"w":"number","s":17.29,"e":17.734},{"w":"that","s":17.734,"e":18.07},{"w":"says","s":18.07,"e":18.406},{"w":"how","s":18.406,"e":18.688},{"w":"much","s":18.688,"e":19.024},{"w":"it","s":19.024,"e":19.252},{"w":"matters.","s":19.252,"e":19.75}]},{"id":"learning","start":20.35,"end":33.758,"sentences":[{"text":"During training, the model guesses, measures its error, and adjusts the weights a little.","start":20.7,"end":26.808},{"text":"Repeat this many times, and the error falls, step by step, until it is small enough.","start":27.188,"end":33.158}],"words":[{"w":"During","s":20.7,"e":21.144},{"w":"training,","s":21.144,"e":21.696},{"w":"the","s":21.876,"e":22.158},{"w":"model","s":22.158,"e":22.548},{"w":"guesses,","s":22.548,"e":23.046},{"w":"measures","s":23.226,"e":23.778},{"w":"its","s":23.778,"e":24.06},{"w":"error,","s":24.06,"e":24.45},{"w":"and","s":24.63,"e":24.912},{"w":"adjusts","s":24.912,"e":25.41},{"w":"the","s":25.41,"e":25.692},{"w":"weights","s":25.692,"e":26.19},{"w":"a","s":26.19,"e":26.364},{"w":"little.","s":26.364,"e":26.808},{"w":"Repeat","s":27.188,"e":27.632},{"w":"this","s":27.632,"e":27.968},{"w":"many","s":27.968,"e":28.304},{"w":"times,","s":28.304,"e":28.694},{"w":"and","s":28.874,"e":29.156},{"w":"the","s":29.156,"e":29.438},{"w":"error","s":29.438,"e":29.828},{"w":"falls,","s":29.828,"e":30.218},{"w":"step","s":30.398,"e":30.734},{"w":"by","s":30.734,"e":30.962},{"w":"step,","s":30.962,"e":31.298},{"w":"until","s":31.478,"e":31.868},{"w":"it","s":31.868,"e":32.096},{"w":"is","s":32.096,"e":32.324},{"w":"small","s":32.324,"e":32.714},{"w":"enough.","s":32.714,"e":33.158}]},{"id":"remember","start":33.758,"end":40.306,"sentences":[{"text":"So, an AI model learns by adjusting its weights to make fewer mistakes on examples.","start":34.108,"end":39.706}],"words":[{"w":"So,","s":34.108,"e":34.336},{"w":"an","s":34.516,"e":34.744},{"w":"AI","s":34.744,"e":34.972},{"w":"model","s":34.972,"e":35.362},{"w":"learns","s":35.362,"e":35.806},{"w":"by","s":35.806,"e":36.034},{"w":"adjusting","s":36.034,"e":36.64},{"w":"its","s":36.64,"e":36.922},{"w":"weights","s":36.922,"e":37.42},{"w":"to","s":37.42,"e":37.648},{"w":"make","s":37.648,"e":37.984},{"w":"fewer","s":37.984,"e":38.374},{"w":"mistakes","s":38.374,"e":38.926},{"w":"on","s":38.926,"e":39.154},{"w":"examples.","s":39.154,"e":39.706}]}]}
